accumulate,,,,,,,,,in:vendor_set,in:product_types_set,in:total_quantity,out:Shipping Method,out:Package,out:Handling Fee,out:Zone 1,out:Zone 2,out:Zone 3,out:Zone 4,out:Zone 5$(ProSpec),$in > $(Recombinant protein),<7,FedEx International Express Styrofoam Box,ice packs/blue ice,2000,7000,8000,17500,17500,25000$(ProSpec),$in > $(Recombinant protein),>6,FedEx International Express Styrofoam Box,ice packs/blue ice,2000,12000,13000,17500,17500,25000$(ProSpec),$in > $(Recombinant protein),>6,FedEx NextDay Styrofoam Box,ice packs/blue ice,2000,8500,,,,$(ProSpec),,,FedEx International Express Small Box,,,4500,5500,6500,6000,8000$(ProSpec),,,FedEx NextDay Small Box,,,5500,,,,